Company_Brand,Founded,HeadQuarter,Sector,What_it_does,Founders,Investor,Amount($),Stage,Funding_Year,Year_of_existence,Actual_date,Year
Aqgromalin,2019-01-01,Chennai,Agriculture,Cultivating Ideas for Profit,"Prasanna Manogaran, Bharani C L",Angel investors,200000.0,Seed,2020-01-01,365 days,2018-01-01,2018
Krayonnz,2019-01-01,Bengaluru,Education,An academy-guardian-scholar centric ecosystem which provides state of the art technological solutions.,"Saurabh Dixit, Gurudutt Upadhyay",GSF Accelerator,100000.0,Pre_seed,2020-01-01,365 days,2018-01-01,2018
PadCare Labs,2018-01-01,Pune,Healthcare & Life sciences,Converting bio-hazardous waste to harmless waste,Ajinkya Dhariya,Venture Center,3000000.0,Pre_seed,2020-01-01,730 days,2019-01-01,2019
NCOME,2020-01-01,New Delhi,IT & Technology,Escrow-as-a-service platform,Ritesh Tiwari,"Venture Catalysts, PointOne Capital",400000.0,Seed,2020-01-01,0 days,2017-01-01,2017
Gramophone,2016-01-01,Indore,Agriculture,Gramophone is an AgTech platform enabling access to agri inputs and powering efficient farm management.,"Ashish Rajan Singh, Harshit Gupta, Nishant Mahatre, Tauseef Khan","Siana Capital Management, Info Edge",340000.0,Seed,2020-01-01,1461 days,2021-01-01,2021
qZense,2019-01-01,Bengaluru,Agriculture,qZense Labs is building the next-generation IoT solution for fresh food quality assessment and management.,"Rubal Chib, Dr Srishti Batra","Venture Catalysts, 9Unicorns Accelerator Fund",600000.0,Seed,2020-01-01,365 days,2018-01-01,2018
Metvy,2018-01-01,Gurugram,IT & Technology,AI driven networking platform for individuals and organisations which aims to provided a seamless end to end networking experience.,Shawrya Mehrotra,HostelFund,3000000.0,Seed,2020-01-01,730 days,2019-01-01,2019
Gig India,2017-01-01,Pune,Business Services,GigIndia is a marketplace that provides on-demand work completion for companies through a gig workforce of jobseekers.,"Aditya Shirole, Sahil Sharma","Shantanu Deshpande, Subramaniam Ramadorai",1000000.0,Seed,2020-01-01,1095 days,2020-01-01,2020
Slurrp Farm,2016-01-01,Gurugram,Consumer Goods,Slurrp Farm is a children health food brand.,Meghana Narayan,Fireside Ventures,2000000.0,Series_A,2020-01-01,1461 days,2021-01-01,2021
Medfin,2017-01-01,Bengaluru,Healthcare & Life sciences,Medfin is a Discovery platform for medical procedures and financing.,"Arjun Kumar, Arun Kumar, Sidharth Gurjar","Axilor Ventures, S.D. Shibulal",3000000.0,Series_A,2020-01-01,1095 days,2020-01-01,2020
OurEye.ai,2020-01-01,Bengaluru,IT & Technology,"Video intelligence solution for Enterprise Standard Operating Procedures Monitoring and Quality Control, leveraging CCTV infrastructure.","Miran Junaidi, Saurabh Ghanekar, Sourav Sanyal","100X VC, Amara Ventures",120000.0,Seed,2020-01-01,0 days,2017-01-01,2017
Shiprocket,2017-01-01,New Delhi,Retail,Shiprocket helps online retailers simplify their shipping by providing a delightful post purchase experience to their consumers.,"Gautam Kapoor, Saahil Goel, Vishesh Khurana","Bertelsmann India Investments, InnoVen Capital",7500000.0,Seed,2020-01-01,1095 days,2020-01-01,2020
Moneyboxx Finance,2019-01-01,New Delhi,IT & Technology,MONEYBOXX FINANCE LTD is committed to providing easy access to financing to the deserving micro enterprises in the tier 2 and tier 3 cities of India,Prashant Agarwal,"BlackSoil, Caspian",1000000.0,Seed,2020-01-01,365 days,2018-01-01,2018
EWar,2019-01-01,Bengaluru,Others,EWar Games is a e-sports and real-time gaming start-up.,"Parth Chadha, Rahul Singh","Jindal Steels, Jeet Banerjee",3000000.0,Seed,2020-01-01,365 days,2018-01-01,2018
SucSEED Indovation,2016-01-01,Hyderabad,IT & Technology,"SucSEED INDOVATION FACILITATES ACCESS TO CAPITAL FOR DEEP TECH STARTUPS TO INNOVATE, SCALE & GROW",Vikrant Varshney,Undisclosed,5000000.0,Seed,2020-01-01,1461 days,2021-01-01,2021
TaxBuddy.com,2019-01-01,Mumbai,IT & Technology,TaxBuddy for any tax related issues.,Sujit Bangar,Zenith Global,1000000.0,Seed,2020-01-01,365 days,2018-01-01,2018
Awign Enterprises,2016-01-01,Bengaluru,Business Services,Operations and manpower outsourcing startup,"Annanya Sarthak, Gurpreet Singh, Praveen Sah","Unitus Ventures, Work10M",500000.0,Seed,2020-01-01,1461 days,2021-01-01,2021
Circle of Angels,2018-01-01,Gurugram,IT & Technology,Circles of Angels aims to solve this issue through the creation of a funding network that makes impact funding accessible to everyone.,Karanpal Singh,Undisclosed,3000000.0,Seed,2020-01-01,730 days,2019-01-01,2019
CoinDCX,2017-01-01,Mumbai,IT & Technology,CoinDCX is a company that specializes in crypto-enabled financial services.,"Neeraj Khandelwal, Sumit Gupta","Coinbase Ventures, Polychain",10000000.0,Series_B,2020-01-01,1095 days,2020-01-01,2020
Glance,2016-01-01,Bengaluru,IT & Technology,Glance is a screen zero platform that consumers use across connected devices to experience the Internet.,Naveen Tewari,Mithril Capital Management.,145000000.0,Seed,2020-01-01,1461 days,2021-01-01,2021
Voosh,2020-01-01,Bengaluru,Consumer Goods,Building India's largest digital food service brand,Priyam Saraswat,Better Capital,3000000.0,Pre_seed,2020-01-01,0 days,2017-01-01,2017
Countingwell,2018-01-01,Bengaluru,Education,"An interactive Maths app, Countingwell breaks Maths concepts into short, simple modules that get kids learning with the least amount of screen time.",Nirmal Shah,"Delhi Private School, UAE, Interstar",1000000.0,Seed,2020-01-01,730 days,2019-01-01,2019
Callify.ai,2016-01-01,Mumbai,IT & Technology,Callify.ai is a Voice-Based Candidate Screening & Engagement platform for Talent Acquisition teams.,"Chetan Indap, Sunny Sharma, Deepanti Kavi",Malpani Ventures,560000.0,Seed,2020-01-01,1461 days,2021-01-01,2021
Hudle,2016-01-01,New Delhi,Others,Hudle is a sports & fitness discovery & booking platform with 300+ sports venues and sports events/tournaments available for booking.,Suhail Narain,Survam Partners,3000000.0,Seed,2020-01-01,1461 days,2021-01-01,2021
BiteSpeed,2019-01-01,Gurugram,Retail,Chat-based commerce for E-commerce brands,"Vinayak, Kshitij Abhishek, Apoorv Sadana",Whiteboard Capital,275000.0,Seed,2020-01-01,365 days,2018-01-01,2018
WakeFit,2016-01-01,Bengaluru,Retail,Wakefitkart is a mattress manufacturing company,"Ankit Garg, Chaitanya Ramalingegowda",Sequoia Capital.,20000000.0,Series_B,2020-01-01,1461 days,2021-01-01,2021
Fleeca India,2016-01-01,Jaipur,Transportation & Logistics,FLEECA is a Tyre Care Provider company.,Tikam Jain,Bridgestone India,3000000.0,Seed,2020-01-01,1461 days,2021-01-01,2021
M1xchange,2017-01-01,Gurugram,IT & Technology,M1 an online exchange for TReDS set up under the approval RBI to facilitate discounting of invoices on a PAN India basis.,Sundeep Mohindru,"BEENEXT, Mayfield Fund",4500000.0,Seed,2020-01-01,1095 days,2020-01-01,2020
PagarBook,2019-01-01,Bengaluru,IT & Technology,"Staff's Salary, Work & Attendance Management Application","Adarsh Kumar, Rupesh Mishra","Sequoia Capital, India Quotient",15000000.0,Series_A,2020-01-01,365 days,2018-01-01,2018
PointOne Capital,2020-01-01,Bengaluru,IT & Technology,Pre-seed/Seed focussed VC investor,Mihir Jha,Undisclosed,3000000.0,Seed,2020-01-01,0 days,2017-01-01,2017
Ayana,2017-01-01,Bengaluru,Energy,Ayana Renewable Power is an Indian renewable energy platform,Shivanand N,"NIIF Ltd, CDC Group",390000000.0,Seed,2020-01-01,1095 days,2020-01-01,2020
Tinker Coders,2020-01-01,Noida,Education,Tinker Coder is a LIVE Online Platform through which kids will learn the art of coding,Anoop Gautam,STEMROBO Technologies,3000000.0,Seed,2020-01-01,0 days,2017-01-01,2017
HappyLocate,2016-01-01,Bengaluru,IT & Technology,"HappyLocate is India's first One Stop Relocation Platform, transforming the way Employee Relocations are managed","Ajay Tiwari, Sainadh Duvvuru",The CoWrks Foundry,500000.0,Seed,2020-01-01,1461 days,2021-01-01,2021
Loop Health,2017-01-01,Pune,Healthcare & Life sciences,Loop Health is bringing ease and choice to patients seeking major medical treatments.,"Mayank Kale, Ryan Singh","Y Combinator, Sierra Ventures",2300000.0,Seed,2020-01-01,1095 days,2020-01-01,2020
NeoDocs,2020-01-01,Mumbai,Healthcare & Life sciences,Neodocs analyses medical reports and provides personalised health recommendations remotely.,"Anurag Meena, Nikunj Malpani, Pratik Lodha",9Unicorns Accelerator Fund,3000000.0,Pre_seed,2020-01-01,0 days,2017-01-01,2017
The ePlane,2016-01-01,Chennai,Manufacturing,Transforming the mobility landscape using aerial transport.,"Satya Chakravarthy, Pranjal Mehta",Speciale Invest,3000000.0,Seed,2020-01-01,1461 days,2021-01-01,2021
TagMango,2019-01-01,Mumbai,Business Services,"TagMango is a marketing and advertising app that helps influencer, and brands to partner with individuals.","Divyanshu Damani, Mohammad Hasan","XRM Media, Kevin Lin",700000.0,Seed,2020-01-01,365 days,2018-01-01,2018
The New Shop,2019-01-01,New Delhi,Retail,The New Shop is a chain of high speed retail stores,"Charak Almast, Aastha Almast, Mani Dev Gyawali",Huddle Accelerator,500000.0,Seed,2020-01-01,365 days,2018-01-01,2018
DebugsBunny,2020-01-01,Pune,Education,DebugsBunny is the best Kids Coding Platform where kids are taught to code online by our expert teachers.,Sumit Sanjay Singare,India Angel Fund,100000.0,Seed,2020-01-01,0 days,2017-01-01,2017
Humus,2019-01-01,Bengaluru,Agriculture,Farmgate to Retail outlet Agri-Fresh produce supply chain,"Manjunatha T N, Shilpa Gopalaiah","Venture Catalysts, 9Unicorns, We Founders Circle.",3000000.0,Seed,2020-01-01,365 days,2018-01-01,2018
Artivatic.ai,2017-01-01,Bengaluru,IT & Technology,"Artivatic's patent pending technology solves complex problems in Insurance for On-boarding, Fraud, Risk Profiling, Underwriting & claims.",Layak Singh,"SenseAI Ventures, Saurabh Chugh",3000000.0,Seed,2020-01-01,1095 days,2020-01-01,2020
Prescinto,2016-01-01,Ahmedabad,Energy,Prescinto provides solutions for solar monitoring and analytics solutions.,"Puneet Singh Jaggi, Sanjay Bhasin, Ram Menon","Startup incubator, Accelerator Venture Catalysts",3000000.0,Seed,2020-01-01,1461 days,2021-01-01,2021
Toppeq,2019-01-01,Mumbai,IT & Technology,SaaS-based equity management platform,Nandini Sankar,Undisclosed,3000000.0,Seed,2020-01-01,365 days,2018-01-01,2018
Bolo Indya,2019-01-01,Gurugram,Others,"Bolo Indya is a short video & commerce platform. It allows users to create, watch and share videos & discover and avail services.","Tanmai Paul, Varun Saxena","India Accelerator, Sunil Kamath",400000.0,Seed,2020-01-01,365 days,2018-01-01,2018
Bombay Play,2017-01-01,Bengaluru,Others,Bombay Play is a Card and Toy Company Making games for India.,"Abhas Saroha, Oliver Jones, Oliver Jones","Ramakant Sharma, Leo Capital India",1000000.0,Seed,2020-01-01,1095 days,2020-01-01,2020
KIKO TV,2020-01-01,Mumbai,Others,KIKO TV is an AI-based short live video e-commerce platform.,"Shivam Varshney, Alok Chawla","9Point8 Capital, Sunil Kumar Singhvi",3000000.0,Seed,2020-01-01,0 days,2017-01-01,2017
DealShare,2018-01-01,Jaipur,Retail,DealShare is a Social Commerce Startup,"Sankar Bora, Sourjyendu Medda, Vineet Rao","Falcon Edge Capital, Omidyar Network",21000000.0,Seed,2020-01-01,730 days,2019-01-01,2019
Gamerji,2018-01-01,Ahmedabad,Media & Entertainment,"Gamerji is an online esports gaming platform where tournaments are created for different games such as PUBG, COD, Free Fire etc.","Soham Thacker, Valay Patel, Varun Gajjar",La Gajjar Group.,3000000.0,Seed,2020-01-01,730 days,2019-01-01,2019
Ethereum Push Notification Service,2020-01-01,Mumbai,IT & Technology,EPNS is a decentralized notification protocol,"Harsh Rajat, Richa Joshi",Prolific angel investors,750000.0,Seed,2020-01-01,0 days,2017-01-01,2017
Mihup,2016-01-01,Kolkata,IT & Technology,Intelligence-based personal mobile assistant app,"Biplab Chakraborty, Sandipan Chattopadhyay, Sandipan Mandal, Tapan Barman","Ideaspring Capital, Accel",1500000.0,Series_A,2020-01-01,1461 days,2021-01-01,2021
RuralBasket,2019-01-01,Tirunelveli,Retail,Naturally grown and healthy products directly from farmers.,Palani Rajan,Nativelead Foundation,500000.0,Seed,2020-01-01,365 days,2018-01-01,2018
Infra.Market,2016-01-01,Thane,Real Estate,Hella Infra Market develops an online procurement marketplace intended to serve the real estate and construction materials industry.,"Aaditya Sharda, Souvik Sengupta","Trifecta Capital Advisors, Nexus Venture Partners",20000000.0,Series_B,2020-01-01,1461 days,2021-01-01,2021
Codingal,2020-01-01,Bengaluru,Education,Coding education platform for K-12 students,"Satyam Baranwal, Vivek Prakash","Pras Hanuma, Rebright Partners, Java Capital, and GSF Accelerator.",560000.0,Seed,2020-01-01,0 days,2017-01-01,2017
CRED,2018-01-01,Bengaluru,IT & Technology,CRED is a members-only app that rewards the user with exclusive rewards for paying credit card bills.,Kunal Shah,"General Catalyst, Ribbit Capital",80000000.0,Seed,2020-01-01,730 days,2019-01-01,2019
Let's Dive,2020-01-01,Bengaluru,IT & Technology,A platform for remote employee engagement and building team culture,"Nitesh Agrawal, Om Prakash",Surge,1700000.0,Seed,2020-01-01,0 days,2017-01-01,2017
SAWO Labs,2020-01-01,Mumbai,IT & Technology,Providing Secure Authentication solutions to Apps and Websites. Eliminating Passwords and OTPs for a seamless User Experience.,Prabhat Sahu,"StartupXseed Ventures, 100X.VC",600000.0,Seed,2020-01-01,0 days,2017-01-01,2017
Kyt,2020-01-01,Singapore,Education,Holistic education for every child | Individual and small group live classes for ages 5 - 15 years,"Bhavik Rathod, Tripti Ahuja",Sequoia Capital India’s Surge,2500000.0,Seed,2020-01-01,0 days,2017-01-01,2017
GetWork,2019-01-01,Gurugram,Business Services,GetWork is a campus recruiting platform to post your jobs and hire across dozens of colleges at once.,Rahul Veerwal,India Accelerator,40000.0,Pre_seed,2020-01-01,365 days,2018-01-01,2018
Mobile Premier League (MPL),2018-01-01,Bengaluru,Others,Mobile Premier League is a skill-based eSports platform used to offer cash prizes while playing games.,"Sai Srinivas Kiran G, Shubham Malhotra","Pegasus Tech Ventures, Base Partners",500000.0,Series_B,2020-01-01,730 days,2019-01-01,2019
Omatra Hotels,2017-01-01,Kolkata,Travel & Tourism,Omatra is very new hotel management firm recently registered as Omatra Hospitality Services Private Limited.,"NAVEED AHAMED, SYED SAQQA ABBAS",Capify,3000000.0,Seed,2020-01-01,1095 days,2020-01-01,2020
Awign,2016-01-01,Bengaluru,Business Services,Operations and manpower outsourcing startup,"Annanya Sarthak, Gurpreet Singh, Praveen Sah","Unitus Ventures, Work10M",3000000.0,Seed,2020-01-01,1461 days,2021-01-01,2021
NewsReach,2018-01-01,Gujarat,Others,NewsReach India offers partner publications a digital footprint and monetisation of their content via advertisements.,"Darshan Shah, Soniya Kundnani","Mumbai Angels, JITO Angel Network.",1500000.0,Seed,2020-01-01,730 days,2019-01-01,2019
Credgenics,2018-01-01,New Delhi,IT & Technology,"Credgenics is a tech-enabled platform backed by Titan Capital, helping fintech lenders and Banks in their critical NPA reduction","Anand Agrawal, Mayank Khera, Rishabh Goel","Accel India, Breadlake Ventures",3000000.0,Seed,2020-01-01,730 days,2019-01-01,2019
GeoIQ,2018-01-01,Bengaluru,IT & Technology,"Map-based intelligent platform with single-click access to street-level location data - demographics, competitions, movements - for retail.","Devashish Fuloria, Tusheet Shrivastava, Ankita Thakur","Ankur Mittal, Mitesh Shah",300000.0,Seed,2020-01-01,730 days,2019-01-01,2019
Power Gummies,2018-01-01,New Delhi,Healthcare & Life sciences,Power Gummies are a team of passionate givers who are dedicated to catering nutritional supplements,Divij Bajaj,Venture Catalysts,3000000.0,Bridge,2020-01-01,730 days,2019-01-01,2019
AlgoBulls,2019-01-01,Mumbai,IT & Technology,Algobulls is a state-of-the-art Trading Platform where customers are provided with Fully Automated Algorithmic Trading,"Pushpak Dagade, Jimmit Patel and Suraj Bathija",Venture Catalysts,200000.0,Seed,2020-01-01,365 days,2018-01-01,2018
Credgenics,2018-01-01,Gurugram,IT & Technology,"Credgenics is a tech-enabled platform backed by Titan Capital, helping fintech lenders and Banks in their critical NPA reduction","Anand Agrawal, Mayank Khera, Rishabh Goel","Accel India, Breadlake Ventures",3000000.0,Seed,2020-01-01,730 days,2019-01-01,2019
Ensuredit,2019-01-01,Gurugram,IT & Technology,ENSUREDIT enables and empowers end customers and Insurance Intermediaries with AI-based product platforms for transformational customer experience.,"Amit, Rohit Sadhu, and Vikas Ranga",Venture Catalysts,300000.0,Seed,2020-01-01,365 days,2018-01-01,2018
LightSpeedAI,2019-01-01,Bengaluru,IT & Technology,Developer of an optoelectronic processor designed to accelerate AI computations.,"Rohin Y, PV Ramana","YourNest, growX ventures",3000000.0,Seed,2020-01-01,365 days,2018-01-01,2018
Grip Invest,2020-01-01,Gurugram,IT & Technology,Grip is an investment platform that allows retail investors to make small ticket investments in physical assets that earn lease income.,"Nikhil Aggarwal, Vivek Gulati",Gemba Capital,3000000.0,Seed,2020-01-01,0 days,2017-01-01,2017
Yellow Classes,2020-01-01,Gurugram,Education,New-age fun-learning platform for kids.,"Arpit Mittal, Anshul Gupta",India Quotient,1300000.0,Seed,2020-01-01,0 days,2017-01-01,2017
Plum,2019-01-01,Bengaluru,Healthcare & Life sciences,High quality health insurance and health benefits,"Abhishek Poddar, Saurabh Arora","Surge, Tanglin Venture Partners",4100000.0,Seed,2020-01-01,365 days,2018-01-01,2018
STAGE,2019-01-01,Indore,Media & Entertainment,STAGE is an Indian language content platform for artist-led entertainment.,"Shashank Vaishnav, Vinay Singhal, Parveen Singhal",Venture Catalysts,1000000.0,Seed,2020-01-01,365 days,2018-01-01,2018
NIRA,2017-01-01,Bengaluru,IT & Technology,"NIRA promotes financial inclusion by creating simple, transparent products that empower individuals to live a life of choice and freedom.","Rohit Sen, Nupur Gupta","Techstars Bangalore Accelerator, Techstars",1000000.0,Seed,2020-01-01,1095 days,2020-01-01,2020
Prolixr,2018-01-01,Gurugram,Consumer Goods,A premium skincare brand committed towards building innovative skin care wellness.,"Aditya Sharma, Jayesh Hans","Alfa Ventures, Divij Bajaj",3000000.0,Seed,2020-01-01,730 days,2019-01-01,2019
DaMENSCH,2018-01-01,Bengaluru,Retail,DaMENSCH is a designer and seller of men's apparel.,"Anurag Saboo, Gaurav Pushkar","Whiteboard Capital, Matrix Partners India",6000000.0,Seed,2020-01-01,730 days,2019-01-01,2019
SignalX,2018-01-01,Hyderabad,IT & Technology,SignalX offers an artificial intelligence-powered SaaS platform,"Govind Balachandran, Zakir Wahab, Piyush Arora","9Unicorns, 3Lines VC, Hyderabad Angels",800000.0,Seed,2020-01-01,730 days,2019-01-01,2019
Lancify,2018-01-01,Bengaluru,Education,Lancify is building the world's strongest young workforce,"Gowtham Sundaresan, Azan Barodawala","Techstars, Techstars Bangalore Accelerator",300000.0,Seed,2020-01-01,730 days,2019-01-01,2019
Instoried,2018-01-01,Bengaluru,IT & Technology,Instoried is an augmented writing platform which improves customer interest and engagement.,"Sharmin Ali, Sutanshu Raj","Venture Catalysts, SOSV",1000000.0,Seed,2020-01-01,730 days,2019-01-01,2019
Arata,2017-01-01,New Delhi,Retail,Arata is an e-commerce site for beauty products and cosmetics.,"Dhruv Madhok, Dhruv Bhasin",DSG Consumer Partners,1000000.0,Seed,2020-01-01,1095 days,2020-01-01,2020
MPL,2018-01-01,Bengaluru,Others,Mobile Premier League is a skill-based eSports platform used to offer cash prizes while playing games.,"Sai Srinivas Kiran G, Shubham Malhotra","Pegasus Tech Ventures, Base Partners",5000000.0,Seed,2020-01-01,730 days,2019-01-01,2019
Thrive,2020-01-01,Mumbai,Consumer Goods,"Thrive is all-in-one restaurant ordering suite for table ordering, pickup, and delivery with marketing in-built.","Dhruv Dewan, Krishi Fagwani","Whiteboard Capital, Ahimsa Capital",3000000.0,Seed,2020-01-01,0 days,2017-01-01,2017
Kitchens Centre,2019-01-01,New Delhi,Real Estate,Kitchens Centre offers turnkey solutions to cloud kitchens.,Lakshay Jain,"Jonathan Swanson, Ankush Gera",3000000.0,Seed,2020-01-01,365 days,2018-01-01,2018
Prescribe,2019-01-01,Chennai,Healthcare & Life sciences,Provide online services to patients by leveraging WhatsApp.,Nived Narayanan,Titan Capital,100000.0,Seed,2020-01-01,365 days,2018-01-01,2018
Arzooo,2016-01-01,Bengaluru,IT & Technology,"B2B retail tech platform transforming 300,000+ SMEs in electronics space with its flagship ""Go Store"" product","Khushnud Khan, Rishi Raj Rathore","3Lines, Jabbar Internet Group",3000000.0,Seed,2020-01-01,1461 days,2021-01-01,2021
Slice,2016-01-01,Bengaluru,IT & Technology,Slice is a card for first-time credit card users. They are inventing the future of finance for young Indians,"Deepak Malhotra, Rajan Bajaj","Better Capital, Gunosy",5000000.0,IPO,2020-01-01,1461 days,2021-01-01,2021
Rapawalk,2017-01-01,Bengaluru,Retail,Rapawalk is an online brand that offers a personalized service of creating your own shoes.,"Kashif Mohammad, Aravind Maddireddy","Sanjay Ramakrishnan, Ravi Garikipati",300000.0,Seed,2020-01-01,1095 days,2020-01-01,2020
Oga Fit's,2017-01-01,Bengaluru,Healthcare & Life sciences,The new-age home workout app that gives you an unmatched boutique digital fitness studio experience.,Ashish Rawat,9Unicorns,3000000.0,Seed,2020-01-01,1095 days,2020-01-01,2020
LAVAL,2016-01-01,Bengaluru,Consumer Goods,"Laval Cosmetics, affordable makeup for all ages","Shrishti, Prithika",Jazal Group,3000000.0,Seed,2020-01-01,1461 days,2021-01-01,2021
Stride Ventures,2019-01-01,New Delhi,IT & Technology,Stride Ventures is a venture capital firm in India which aims to invest in innovative startups across the country.,Ishpreet Gandhi,Small Industries Development Bank of India,80000000.0,Seed,2020-01-01,365 days,2018-01-01,2018
BlackSoil,2016-01-01,Mumbai,IT & Technology,Blacksoil Advisory is an independent boutique advisory firm.,Ankur Bansal,Undisclosed,10000000.0,Seed,2020-01-01,1461 days,2021-01-01,2021
GalaxyCard,2017-01-01,Gurugram,IT & Technology,Mobile based Instant credit card. | Easiest way to get a credit card. Get one in 3 minutes,"Amit Kumar, Gunjeet Singh",India Accelerator,3000000.0,Seed,2020-01-01,1095 days,2020-01-01,2020
MoooFarm,2019-01-01,Gurugram,Agriculture,MoooFarm is an information technology company that bridges the technology gap to help marginalized dairy farmers.,"Param Singh, Aashna Singh, Abhijeet Mittal, Jitesh Arora","Navus Ventures, Rockstart",500000.0,Pre_seed,2020-01-01,365 days,2018-01-01,2018
BitClass,2020-01-01,Bengaluru,IT & Technology,BitClass is a PaaS solution which helps teachers set up their independent live classes,"Gunjan Kejriwal, Utsav Tiwary","AET Japan, Figure Eight Investments, Waterbridge Ventures",2000000.0,Seed,2020-01-01,0 days,2017-01-01,2017
Gonuts,2020-01-01,Mumbai,Others,Personalised Video shoutouts from favourite celebrity.,"Vinamra Pandiya, Mayank Gupta, Joji George","Sweta Rau, Archana Priyadarshini",400000.0,Seed,2020-01-01,0 days,2017-01-01,2017
Jade Forest,2017-01-01,Delhi,Consumer Goods,"NATURALLY THE BEST From zero artificial ingredients in our drinks to the way they make you feel, we bring you a bespoke range of natural mixers.","Punweet Singh, Shuchir Suri",Undisclosed,250000.0,Seed,2020-01-01,1095 days,2020-01-01,2020
FrontRow,2017-01-01,Bengaluru,Education,"Comprehensive courses, taught by idols.","Mikhil Raj, Shubhadit Sharma, Ishaan Preet Singh","Lightspeed, Elevation, Deepika Padukone",3200000.0,Seed,2020-01-01,1095 days,2020-01-01,2020
TUBBR,2019-01-01,Frisco,Others,World's First Personal Social Network,"Saurabh Uttam, Ravi Singhal",Global Ascent Partners,3000000.0,Seed,2020-01-01,365 days,2018-01-01,2018
LivFin,2017-01-01,New Delhi,IT & Technology,LivFin is a non-banking financial company registered with the Reserve Bank of India (RBI),Rakesh Malhotra,"DEG, KFW DEG",4700000.0,Seed,2020-01-01,1095 days,2020-01-01,2020
Lattu Kids,2017-01-01,Mumbai,Education,Lattu kids is an edutainment platform for preschool kids.,Vivek Bhutyani,Mumbai Angels Network,3000000.0,Seed,2020-01-01,1095 days,2020-01-01,2020
Eggoz,2016-01-01,Indore,Consumer Goods,"Eggoz is a brand of fresh and chemical-free eggs, produced in tech-enabled & nutrition-engineered deep integration partnership with farmers.","Abhishek Negi, Aditya Singh, Pankaj Pandey, Uttam Kumar","AVANA Capital, Rebright Partners",1500000.0,Seed,2020-01-01,1461 days,2021-01-01,2021
Steradian Semiconductors,2016-01-01,Bengaluru,IT & Technology,Semiconductor company focused on CMOS millimeter wave products for Radar.,"Gireesh Rajendran, Ashish Lachhwani, Apu Sivadas, Rakesh Kumar and Alok Joshi",Endiya Partners.,3000000.0,Seed,2020-01-01,1461 days,2021-01-01,2021
CHARGE+ZONE,2018-01-01,Gujarat,Transportation & Logistics,"Charge+Zone provides services in renewable energy solutions, product development, and software engineering company.","Kartikey Hariyani, Pavan Bakeri",Mumbai Angels,3000000.0,Seed,2020-01-01,730 days,2019-01-01,2019
Gully Network,2019-01-01,Bengaluru,Retail,Gully Network is a tech-enabled network of mid-sized grocery stores.,"Ajay Nain, Prateek Chaturvedi","CP Ventures, Orios Venture Partners",1200000.0,Seed,2020-01-01,365 days,2018-01-01,2018
TurboHire,2018-01-01,Hyderabad,Business Services,Talent Intelligence Platform for enterprises that helps recruiters discover the right candidates for a job using a Human-like AI,"Abhishek Kabra, Aman Gour","Kia Ora Ventures, Pentathlon Ventures",1000000.0,Seed,2020-01-01,730 days,2019-01-01,2019
Traya,2017-01-01,Mumbai,Healthcare & Life sciences,work with our customers closely to get their hair health sorted for long-term effective results,"Altaf Saiyed, Saloni Anand","Kae Capital, Whiteboard Capital",3000000.0,Seed,2020-01-01,1095 days,2020-01-01,2020
