Company_Brand,Founded,HeadQuarter,Sector,What_it_does,Founders,Investor,Amount($),Stage,Funding_Year,Year_of_existence,Actual_date,Year
Mintifi,2017-01-01,Mumbai,Financial Services,Online lending startup based in Mumbai.,Undisclosed,Undisclosed,2000000.0,Seed,2018-01-01,365 days,2018-01-01,2018
Carcrew,2017-01-01,Mumbai,IT & Technology,India's Online Auto Repair Marketplace,Undisclosed,Undisclosed,2000000.0,Seed,2018-01-01,365 days,2018-01-01,2018
NicheAI,2017-01-01,Hyderabad,IT & Technology,Early stage Artificial Intelligence (AI) start up.,Undisclosed,Undisclosed,1200192.0307249161,Seed,2018-01-01,365 days,2018-01-01,2018
Chariot Tech,2017-01-01,New Delhi,IT & Technology,Chariot Tech is an Internet of Things (IoT) startup based in New Delhi.,Undisclosed,Undisclosed,240038.40614498322,Seed,2018-01-01,365 days,2018-01-01,2018
Ideal Insurance Brokers/ 121Policy.com,2017-01-01,Kolkata,Financial Services,Ideal Insurance Broking is one of the leaders in insurance broking domain.,Undisclosed,Undisclosed,1000000.0,Seed,2018-01-01,365 days,2018-01-01,2018
Loanzen,2017-01-01,Bengaluru,IT & Technology,Loanzen helps small businesses get unsecured working capital loans against their their pending invoices.,Undisclosed,Undisclosed,1200192.0307249161,Seed,2018-01-01,365 days,2018-01-01,2018
Mojro Technologies,2017-01-01,Bengaluru,IT & Technology,Mojro envisions to be the world's largest technology-enabled logistics platform.,Undisclosed,Undisclosed,650000.0,Seed,2018-01-01,365 days,2018-01-01,2018
Elemential,2017-01-01,Mumbai,IT & Technology,"Blockchain Development Platform To Design, Run & Scale Blockchain Networks.",Undisclosed,Undisclosed,1000000.0,Seed,2018-01-01,365 days,2018-01-01,2018
Loadshare,2017-01-01,Bengaluru,Manufacturing,LoadShare is India’s fastest growing logistics company,Undisclosed,Undisclosed,5000000.0,Series_A,2018-01-01,365 days,2018-01-01,2018
Yumlane,2017-01-01,Mumbai,Consumer Goods,Food startup Yumlane operated by QwikPik Technology,Undisclosed,Undisclosed,4000000.0,Series_A,2018-01-01,365 days,2018-01-01,2018
Kriger Campus,2017-01-01,New Delhi,Education,A Education Start Up.,Undisclosed,Undisclosed,360057.6092174748,Seed,2018-01-01,365 days,2018-01-01,2018
Pipa+Bella,2017-01-01,Mumbai,Consumer Goods,Pipa+Bella is an online store aimed at selling fashionable and affordable costume jewelry at par with international standards and trends,Undisclosed,Undisclosed,1000000.0,Series_A,2018-01-01,365 days,2018-01-01,2018
Kaleidofin,2017-01-01,Chennai,IT & Technology,A fintech platform.,Undisclosed,Undisclosed,2800000.0,Seed,2018-01-01,365 days,2018-01-01,2018
Chakr Innovation,2017-01-01,New Delhi,Energy,Chakr has developed the world’s first retro-fit emission control device for diesel generators.,Undisclosed,Undisclosed,1200192.0307249161,Seed,2018-01-01,365 days,2018-01-01,2018
IndigoLearn,2017-01-01,Hyderabad,Education,India's the premier education destination catering to the needs of aspiring students of the CA community.,Undisclosed,Undisclosed,150000.0,Seed,2018-01-01,365 days,2018-01-01,2018
UClean,2017-01-01,India,Energy,UClean is a tech enabled laundry service provider.,Undisclosed,Undisclosed,480076.81228996644,Seed,2018-01-01,365 days,2018-01-01,2018
Coutloot,2017-01-01,Mumbai,IT & Technology,The Fashion Re-commerce platform.,Undisclosed,Undisclosed,1000000.0,Seed,2018-01-01,365 days,2018-01-01,2018
Letstrack,2017-01-01,New Delhi,IT & Technology,"Letstrack GPS tracking devices to track your kids, bike, car and other vehicles. GPS trackers for Vehicle Tracking System in India.",Undisclosed,Undisclosed,1700000.0,Seed,2018-01-01,365 days,2018-01-01,2018
Pooltoo,2017-01-01,New Delhi,Transportation & Logistics,Pooltoo offers a premium ride sharing platform.,Undisclosed,Undisclosed,1200192.0307249161,Seed,2018-01-01,365 days,2018-01-01,2018
Finzy,2017-01-01,Bengaluru,Financial Services,finzy is the premier peer to peer lending solution in India.,Undisclosed,Undisclosed,1300000.0,Seed,2018-01-01,365 days,2018-01-01,2018
Fitternity,2017-01-01,Mumbai,Healthcare & Life sciences,India's largest online fitness platform that provides an integrated eco-system to help users start & sustain their fitness journey,Undisclosed,Undisclosed,2000000.0,Seed,2018-01-01,365 days,2018-01-01,2018
Keito,2017-01-01,Pune,IT & Technology,Building an Intelligent Digital Assistant.,Undisclosed,Undisclosed,1200192.0307249161,Seed,2018-01-01,365 days,2018-01-01,2018
Tolet for Students,2017-01-01,Jodhpur,Healthcare & Life sciences,"Reserve your Room, Hostel or Paying Guest, while relocating for higher education.",Undisclosed,Undisclosed,60009.601536245806,Seed,2018-01-01,365 days,2018-01-01,2018
Chai Kings,2017-01-01,Chennai,Consumer Goods,Chai Kings is a tea retail chain,Undisclosed,Undisclosed,240038.40614498322,Seed,2018-01-01,365 days,2018-01-01,2018
Dainik Jagran,2017-01-01,Kanpur,Media & Entertainment,Dainik Jagran is a media and communications group.,Undisclosed,Undisclosed,480076.81228996644,Seed,2018-01-01,365 days,2018-01-01,2018
Playtoome,2017-01-01,Bengaluru,Media & Entertainment,Playtoome is a live entertainment destination,Undisclosed,Undisclosed,240038.40614498322,Seed,2018-01-01,365 days,2018-01-01,2018
ONGO Framework,2017-01-01,Hyderabad,IT & Technology,ONGO Framework is a B2B IT and digital solution provider.,Undisclosed,Undisclosed,1000000.0,Seed,2018-01-01,365 days,2018-01-01,2018
Notesgen,2017-01-01,New Delhi,IT & Technology,A Global Peer-to-Peer and Peer-to-Group Learning Platform that helps students supplement their academic & competitive exam prep.,Undisclosed,Undisclosed,150024.00384061452,Seed,2018-01-01,365 days,2018-01-01,2018
Arogya MedTech,2017-01-01,Kolkata,Healthcare & Life sciences,Arogya MedTech is a Research & Development organization in Bio-Medical industry.,Undisclosed,Undisclosed,180028.8046087374,Seed,2018-01-01,365 days,2018-01-01,2018
Propshop24,2017-01-01,Mumbai,Retail,"Propshop24, a one-stop shop for a handpicked selection of 'fun'tastic products from around the world.",Undisclosed,Undisclosed,500000.0,Seed,2018-01-01,365 days,2018-01-01,2018
myUpchar,2017-01-01,New Delhi,Healthcare & Life sciences,To bring health issues to people in their language.,Undisclosed,Undisclosed,5000000.0,Series_A,2018-01-01,365 days,2018-01-01,2018
MissMalini Entertainment,2017-01-01,Mumbai,Media & Entertainment,"MissMalini Entertainment is a multi-platform new media network dedicated to Entertaining, Connecting & Empowering young Indians.",Undisclosed,Undisclosed,1248199.7119539126,Seed,2018-01-01,365 days,2018-01-01,2018
Rooter,2017-01-01,India,Sports,Rooter is a mobile-based platform,Undisclosed,Undisclosed,540086.4138262123,Seed,2018-01-01,365 days,2018-01-01,2018
ZestMoney,2017-01-01,Bengaluru,IT & Technology,Zest is India's first completely automated consumer digital lending platform.,Undisclosed,Undisclosed,13400000.0,Series_A,2018-01-01,365 days,2018-01-01,2018
alphaics Corporation,2017-01-01,Bengaluru,IT & Technology,Advancing AI compute,Undisclosed,Undisclosed,1200192.0307249161,Seed,2018-01-01,365 days,2018-01-01,2018
MyDentistChoice,2017-01-01,Hyderabad,Healthcare & Life sciences,MyDentistChoice is a direct sales and distribution of dental equipment and accessories from top name manufacturers,Undisclosed,Undisclosed,500000.0,Seed,2018-01-01,365 days,2018-01-01,2018
Sattviko,2017-01-01,New Delhi,Consumer Goods,Sattviko fosters wellness and shares Indianness through the Sattvik way of cooking that is wholesome and tasty!,Undisclosed,Undisclosed,1200192.0307249161,Seed,2018-01-01,365 days,2018-01-01,2018
Sensibull,2017-01-01,Bengaluru,Financial Services,Investment Management Platform,Undisclosed,Undisclosed,300048.00768122904,Seed,2018-01-01,365 days,2018-01-01,2018
Bombay Shaving Company,2017-01-01,New Delhi,Consumer Goods,Bombay Shaving Company is a Men's grooming startup,Undisclosed,Undisclosed,1200192.0307249161,Series_A,2018-01-01,365 days,2018-01-01,2018
MedCords,2017-01-01,Pune,Healthcare & Life sciences,Medcords is India’s first holistic healthcare ecosystem on a cloud platform that makes health management easier,Undisclosed,Undisclosed,316850.69611137785,Seed,2018-01-01,365 days,2018-01-01,2018
University Living,2017-01-01,New Delhi,Education,University Living is an online global student housing marketplace.,Undisclosed,Undisclosed,1200192.0307249161,Seed,2018-01-01,365 days,2018-01-01,2018
&ME,2017-01-01,Bengaluru,Consumer Goods,Food and Beverage startup focussing on developing products using ayurveda with modern science for women empowerment and fitness.,Undisclosed,Undisclosed,1200192.0307249161,Seed,2018-01-01,365 days,2018-01-01,2018
Enakshi,2017-01-01,Ahmedabad,Consumer Goods,Enakshi is an online apparel brand for women.,Undisclosed,Undisclosed,96015.36245799328,Seed,2018-01-01,365 days,2018-01-01,2018
Ultraviolette Automotive,2017-01-01,Bengaluru,Manufacturing,Ultraviolette is a startup working on electric two-wheelers and energy infrastructure.,Undisclosed,Undisclosed,720.1152184349496,Series_A,2018-01-01,365 days,2018-01-01,2018
Inthree Access,2017-01-01,Chennai,Business Services,Inthree Access is an impact venture that connects the most inaccessible rural markets with products that can transform lives in Rural India.,Undisclosed,Undisclosed,4000000.0,Series_A,2018-01-01,365 days,2018-01-01,2018
BUGWORKS Research India,2017-01-01,Bengaluru,Healthcare & Life sciences,BUGWORKS is a drug discovery company.,Undisclosed,Undisclosed,9000000.0,Series_A,2018-01-01,365 days,2018-01-01,2018
Guardian.in,2017-01-01,Mumbai,Healthcare & Life sciences,GNC is a leading global specialty retailer of health and wellness products that takes pride to be the world's largest company,Undisclosed,Undisclosed,1200192.0307249161,Seed,2018-01-01,365 days,2018-01-01,2018
PrestLoans,2017-01-01,New Delhi,Financial Services,"PrestLoans New age tech driven RBI regd NBFC helping businesses by providing easy, quick n hassle free loans.",Undisclosed,Undisclosed,100000.0,Seed,2018-01-01,365 days,2018-01-01,2018
Wimoxez,2017-01-01,Hyderabad,IT & Technology,"Data Intelligence Publishing Platform, We bring the best resources to learn valuable technologies which will shape tomorrow.",Undisclosed,Undisclosed,20000.0,Seed,2018-01-01,365 days,2018-01-01,2018
India Accelerator,2017-01-01,Gurugram,Business Services,India Accelerator runs mentorship-driven incubation and acceleration programs for start ups.,Undisclosed,Undisclosed,1200192.0307249161,Seed,2018-01-01,365 days,2018-01-01,2018
HappyEMI,2017-01-01,Bengaluru,Financial Services,HappyEMI is a point of sale digital lending platform that helps consumers finance their purchases in-store and online,Undisclosed,Undisclosed,1000000.0,Seed,2018-01-01,365 days,2018-01-01,2018
Wishup,2017-01-01,Azadpur,Others,Premium Personal Assistance service,Undisclosed,Undisclosed,1200192.0307249161,Seed,2018-01-01,365 days,2018-01-01,2018
Hansel.io,2017-01-01,Bengaluru,IT & Technology,"Hansel, a mobile app management platform, provides the infrastructure that companies need, in order to personalize product experiences.",Undisclosed,Undisclosed,4000000.0,Series_A,2018-01-01,365 days,2018-01-01,2018
Propelld,2017-01-01,Bengaluru,Financial Services,Propelld is a student education financing platform.,Undisclosed,Undisclosed,250000.0,Seed,2018-01-01,365 days,2018-01-01,2018
PivotRoots,2017-01-01,Mumbai,Business Services,Digital Marketing powered by Data & Technology; fueled by Design thinking,Undisclosed,Undisclosed,1200192.0307249161,Series_A,2018-01-01,365 days,2018-01-01,2018
ZiffyHomes,2017-01-01,New Delhi,Business Services,ZiffyHomes is a technology driven marketplace to find out home on rent.,Undisclosed,Undisclosed,120000.0,Seed,2018-01-01,365 days,2018-01-01,2018
Carmesi,2017-01-01,Gurugram,Healthcare & Life sciences,Carmesi is a brand of high-end menstrual-hygiene products in India.,Undisclosed,Undisclosed,408065.2904464715,Seed,2018-01-01,365 days,2018-01-01,2018
OckyPocky,2017-01-01,Haryana,IT & Technology,OckyPocky is a interactive and personalised language learning app for preschool kids.,Undisclosed,Undisclosed,1200192.0307249161,Seed,2018-01-01,365 days,2018-01-01,2018
Racetrack,2017-01-01,Bengaluru,IT & Technology,"Racetrack is a sales and support-focused AI-driven platform designed for education, real estate, and e-commerce sectors.",Undisclosed,Undisclosed,4104656.745079213,Seed,2018-01-01,365 days,2018-01-01,2018
WHR,2017-01-01,Pune,IT & Technology,"WHR is to make affordable healthcare a reality for all. Our vision is to make healthcare services easier, better and more accessible.",Undisclosed,Undisclosed,143145.0,Seed,2018-01-01,365 days,2018-01-01,2018
Asteria Aerospace,2017-01-01,Bengaluru,Transportation & Logistics,Asteria Aerospace is a robotics and artificial intelligence company.,Undisclosed,Undisclosed,1200192.0307249161,Seed,2018-01-01,365 days,2018-01-01,2018
FabAlley,2017-01-01,Noida,Consumer Goods,"FabAlley is the ultimate Indian fashion destination for fashion-forward, indie-chic girls. Founded in 2012, Tanvi Malik and Shivani Poddar",Undisclosed,Undisclosed,7201152.184349497,Series_B,2018-01-01,365 days,2018-01-01,2018
Tranzmeo,2017-01-01,Kochi,IT & Technology,Tranzmeo Connect : is A Complete Comprehensive Anomaly forensic Solution with Actionable Insights.,Undisclosed,Undisclosed,1200192.0307249161,Pre_seed,2018-01-01,365 days,2018-01-01,2018
SBI Life,2017-01-01,Mumbai,Financial Services,SBI Life is one of the life insurance company that offers a range of life insurance plans and policies to protect you and your family.,Undisclosed,Undisclosed,742000000.0,Pre_seed,2018-01-01,365 days,2018-01-01,2018
Studds Accessories,2017-01-01,Faridabad,Retail,Studds Accessories is a scooter accessories service provider in India,Undisclosed,Undisclosed,12001920.30724916,Pre_seed,2018-01-01,365 days,2018-01-01,2018
Design Cafe,2017-01-01,Bengaluru,IT & Technology,"Design + Execution Organization that delivers beautiful & innovative designs for Home Interiors, in any budget.",Undisclosed,Undisclosed,24003840.61449832,Series_B,2018-01-01,365 days,2018-01-01,2018
NoPaperForms Solutions Pvt. Ltd.,2017-01-01,New Delhi,IT & Technology,"NoPaperForms is a marketing automation, lead nurture and enrolment management platform for educational institutions",Undisclosed,Undisclosed,3980000.0,Series_B,2018-01-01,365 days,2018-01-01,2018
Rays Power Infra,2017-01-01,Jaipur,Energy,Rays Power Infra is a leading integrated Solar Power Company.,Undisclosed,Undisclosed,24003840.61449832,Series_A,2018-01-01,365 days,2018-01-01,2018
AuthMetrik,2017-01-01,Gurugram,IT & Technology,"SaaS, B2B, Security, Stop account sharing, Fraud Detection",Undisclosed,Undisclosed,10000.0,IPO,2018-01-01,365 days,2018-01-01,2018
Khidki,2017-01-01,Bengaluru,IT & Technology,Vernacular Social Network Focused on Town Level Content and Interactions,Undisclosed,Undisclosed,1200192.0307249161,Seed,2018-01-01,365 days,2018-01-01,2018
LetsTransport,2017-01-01,Bengaluru,Transportation & Logistics,Lets transport is a logistics solution provider.,Undisclosed,Undisclosed,12001920.30724916,Series_B,2018-01-01,365 days,2018-01-01,2018
Next Digital Solutions,2017-01-01,Kota,IT & Technology,Next Digital Solutions is website design & Digital Marketing development company.,Undisclosed,Undisclosed,1200.192030724916,Seed,2018-01-01,365 days,2018-01-01,2018
Portea Medical,2017-01-01,Bengaluru,Healthcare & Life sciences,Portea Medical is the largest and fastest growing provider of in-home medical care in India today with a 24-city network.,Undisclosed,Undisclosed,3000480.07681229,IPO,2018-01-01,365 days,2018-01-01,2018
Aavas Financiers,2017-01-01,Jaipur,Financial Services,"Aavas Financiers is engaged in the business of providing housing loans, primarily in the un-served, unreached and under-served market.",Undisclosed,Undisclosed,24003840.61449832,IPO,2018-01-01,365 days,2018-01-01,2018
Swiggy,2017-01-01,Bengaluru,IT & Technology,Swiggy is a food ordering and delivery company that provides food service solutions for restaurants.,Undisclosed,Undisclosed,1000000000.0,Series_D and Beyond,2018-01-01,365 days,2018-01-01,2018
Milkbasket,2017-01-01,Haryana,IT & Technology,"Milkbasket delivers milk, bread, eggs, butter, juices and other daily need items, every morning, right at your doorstep, free of charge.",Undisclosed,Undisclosed,7000000.0,Series_A,2018-01-01,365 days,2018-01-01,2018
Nutrisattva (Proliva),2017-01-01,Anand,Consumer Goods,Nutrisattva is a protein innovation compan,Undisclosed,Undisclosed,1200192.0307249161,Seed,2018-01-01,365 days,2018-01-01,2018
Toppr,2017-01-01,Mumbai,Education,Toppr.com is an online preparation platform for entrance exams in India.,Undisclosed,Undisclosed,35000000.0,Seed,2018-01-01,365 days,2018-01-01,2018
Jagaran Microfin,2017-01-01,Kolkata,IT & Technology,Jagaran Microfin is a Microfinance institution which achieves a healthy amalgamation of social and financial,Undisclosed,Undisclosed,6601056.168987039,IPO,2018-01-01,365 days,2018-01-01,2018
Vivriti Capital,2017-01-01,Chennai,IT & Technology,Vivriti Capital is an online platform for institutional debt in India.,Undisclosed,Undisclosed,28500000.0,Series_A,2018-01-01,365 days,2018-01-01,2018
Be U Salons,2017-01-01,New Delhi,IT & Technology,Be U is India's first subscription based Salon Chain.,Undisclosed,Undisclosed,360057.6092174748,Seed,2018-01-01,365 days,2018-01-01,2018
Impact Guru,2017-01-01,Mumbai,IT & Technology,"We're a Harvard incubated crowdfunding platform for nonprofits, social enterprises, startups and individuals.",Undisclosed,Undisclosed,2000000.0,Series_A,2018-01-01,365 days,2018-01-01,2018
MobiKwik,2017-01-01,Gurugram,IT & Technology,MobiKwik is a payments backed fintech platform in India. MobiKwik App offers instant loans & investment products to the 500M masses of India,Undisclosed,Undisclosed,2880460.8737397986,Series_D and Beyond,2018-01-01,365 days,2018-01-01,2018
Stones2Milestones,2017-01-01,Gurugram,Education,Stones2milestones is a Gurgaon Based Learning Company.,Undisclosed,Undisclosed,1200192.0307249161,Seed,2018-01-01,365 days,2018-01-01,2018
Generico,2017-01-01,Mumbai,Healthcare & Life sciences,Generico is the fastest growing specialized pharmacy retail chain of Generic medicines.,Undisclosed,Undisclosed,1200192.0307249161,Series_A,2018-01-01,365 days,2018-01-01,2018
Adiuvo Diagnostics,2017-01-01,Chennai,Healthcare & Life sciences,Adiuvo Diagnostics is a medical diagnostic device company based in India.,Undisclosed,Undisclosed,1200192.0307249161,Seed,2018-01-01,365 days,2018-01-01,2018
DataTrained,2017-01-01,Bengaluru,Education,"DataTrained is a educational platform, which operates an ed-tech startup on data science",Undisclosed,Undisclosed,1440230.4368698993,Seed,2018-01-01,365 days,2018-01-01,2018
OneAssist,2017-01-01,Mumbai,IT & Technology,OneAssist is a protection & assistance services platform.,Undisclosed,Undisclosed,2400000.0,IPO,2018-01-01,365 days,2018-01-01,2018
Satin Creditcare Network Limited (SCNL),2017-01-01,New Delhi,Financial Services,Satin is a non-banking finance company providing individual loans to urban shopkeepers.,Undisclosed,Undisclosed,30000000.0,IPO,2018-01-01,365 days,2018-01-01,2018
APAC Financial Services,2017-01-01,Mumbai,Financial Services,APAC Financial Services is a financial services platform.,Undisclosed,Undisclosed,30004800.7681229,Pre_seed,2018-01-01,365 days,2018-01-01,2018
Moglix,2017-01-01,Noida,IT & Technology,"Moglix is a supplier of industrial tools like hand tools, power tools, electrical, and safety equipment.",Undisclosed,Undisclosed,23000000.0,Seed,2018-01-01,365 days,2018-01-01,2018
SEDEMAC Mechatronics,2017-01-01,Mumbai,Manufacturing,SEDEMAC Mechatronics is technology company that distributes control-intensive products for automobiles.,Undisclosed,Undisclosed,1200192.0307249161,Series_A,2018-01-01,365 days,2018-01-01,2018
MadGuy Labs,2017-01-01,Hyderabad,Education,MadGuy Labs is a Online Test-prep Platform.,Undisclosed,Undisclosed,150000.0,Series_A,2018-01-01,365 days,2018-01-01,2018
Dee Dee Labs,2017-01-01,Pune,IT & Technology,Dee Dee Labs is design and development lab with a primary focus on the development of next generation of bionic prostheses.,Undisclosed,Undisclosed,1200192.0307249161,Seed,2018-01-01,365 days,2018-01-01,2018
FLEECA,2017-01-01,Jaipur,Manufacturing,FLEECA is a Tyre Care Provider company.,Undisclosed,Undisclosed,1200192.0307249161,Seed,2018-01-01,365 days,2018-01-01,2018
Shop101,2017-01-01,Mumbai,IT & Technology,#1 Online Selling App. India’s leading social commerce platform. Setup free online store in 2 min. Sell own goods or resell Shop101 Supply.,Undisclosed,Undisclosed,11000000.0,Series_B,2018-01-01,365 days,2018-01-01,2018
FeedMyPockets,2017-01-01,Bengaluru,Business Services,On Demand Staffing Platform,Undisclosed,Undisclosed,528084.4935189631,Seed,2018-01-01,365 days,2018-01-01,2018
Housejoy,2017-01-01,Bengaluru,IT & Technology,Housejoy is a web-based platform that allows individuals to browse and book service providers for their homes.,Undisclosed,Undisclosed,3240000.0,Series_B,2018-01-01,365 days,2018-01-01,2018
Ambee,2017-01-01,Bengaluru,Healthcare & Life sciences,Ambee is an Environment analytics startup.,Undisclosed,Undisclosed,1200192.0307249161,Seed,2018-01-01,365 days,2018-01-01,2018
FoodBuddy,2017-01-01,Belgaum,IT & Technology,"FoodBuddy is a online food delivery portal, providing boundary breaking delivery.",Undisclosed,Undisclosed,720115.2184349496,Seed,2018-01-01,365 days,2018-01-01,2018
Ninjacart,2017-01-01,Bengaluru,Business Services,Ninjacart is a B2B agri-marketing platform that connects vegetables and fruits farmers directly with businesses.,Undisclosed,Undisclosed,30004800.7681229,Series_B,2018-01-01,365 days,2018-01-01,2018
Olly Smart Credit Card,2017-01-01,New Delhi,IT & Technology,Olly is a digital credit card for India's working masses and young people.,Undisclosed,Undisclosed,1200192.0307249161,Seed,2018-01-01,365 days,2018-01-01,2018
Zestl,2017-01-01,Pune,IT & Technology,"No-Code Workflow Automation. Build enterprise applications in days with AI, Cognitive Automation, Collaboration and more built in.",Undisclosed,Undisclosed,1200192.0307249161,Seed,2018-01-01,365 days,2018-01-01,2018
BYJU’S,2017-01-01,Bengaluru,Education,BYJU’s is an edtech company that is reinventing how students learn through its learning app.,Undisclosed,Undisclosed,540000000.0,Pre_seed,2018-01-01,365 days,2018-01-01,2018
Wakefit,2017-01-01,Bengaluru,Manufacturing,Wakefitkart is a mattress manufacturing company. We manufacture the best quality mattresses at affordable prices.,Undisclosed,Undisclosed,7801248.199711954,Series_A,2018-01-01,365 days,2018-01-01,2018
Hero Electric,2017-01-01,New Delhi,Manufacturing,"Hero Electric, a 100% subsidiary of the Hero Group, is a pioneer in the Indian Electric Vehicle Industry.",Undisclosed,Undisclosed,19203072.49159866,Series_A,2018-01-01,365 days,2018-01-01,2018
Pentation Analytics,2017-01-01,Mumbai,IT & Technology,Pentation as an Insurtech enables insurers and intermediaries with our Insurance Analytics Suite- an Insurance specific AI/ML Software Suite,Undisclosed,Undisclosed,1200192.0307249161,Seed,2018-01-01,365 days,2018-01-01,2018
PerkFinance,2017-01-01,Bengaluru,Financial Services,PerkFinance partners with employers to provide affordable loans to their employees at no cost to the company,Undisclosed,Undisclosed,900000.0,Seed,2018-01-01,365 days,2018-01-01,2018
Roposo,2017-01-01,Gurugram,IT & Technology,Roposo - TV by the People is a unique social media platform where people express visually with homemade videos and photos.,Undisclosed,Undisclosed,10000000.0,Seed,2018-01-01,365 days,2018-01-01,2018
Plum Goodness,2017-01-01,Thane,Healthcare & Life sciences,Plum Haircare Is Silicone-Free & Sulphate-Free. Designed For Damaged & Dandruff-Free Hair,Undisclosed,Undisclosed,1200192.0307249161,Series_A,2018-01-01,365 days,2018-01-01,2018
Drstore,2017-01-01,Mumbai,Healthcare & Life sciences,Drstore is a exclusive e- commerce platform.,Undisclosed,Undisclosed,1200192.0307249161,Seed,2018-01-01,365 days,2018-01-01,2018
Wow Venue,2017-01-01,Mumbai,Others,Wow Venue is an online platform.,Undisclosed,Undisclosed,1500000.0,Series_A,2018-01-01,365 days,2018-01-01,2018
Chizel,2017-01-01,Pune,Manufacturing,Chizel is a worlds most advanced cloud platform for on-demand manufacturing in 3D Printing and CNC Machining,Undisclosed,Undisclosed,1200192.0307249161,Seed,2018-01-01,365 days,2018-01-01,2018
OTO Capital,2017-01-01,Mumbai,Manufacturing,OTO Capital is a platform that allows you to own a car faster than ever.,Undisclosed,Undisclosed,600096.0153624581,Seed,2018-01-01,365 days,2018-01-01,2018
Boodmo,2017-01-01,Gurugram,Manufacturing,boodmo.com - large online marketplace for auto parts in India.,Undisclosed,Undisclosed,840134.4215074412,Seed,2018-01-01,365 days,2018-01-01,2018
Khabri,2017-01-01,Haryana,IT & Technology,Khabri is a digital audio platform for content in vernacular.,Undisclosed,Undisclosed,1200192.0307249161,Seed,2018-01-01,365 days,2018-01-01,2018
MyNewCar.in,2017-01-01,Gurugram,Manufacturing,MyNewCar.in offers new cars at best price with great deals. Book a new car online or request a doorstep test drive,Undisclosed,Undisclosed,1000000.0,Series_A,2018-01-01,365 days,2018-01-01,2018
HalaPlay Technologies,2017-01-01,Bengaluru,Media & Entertainment,A daily fantasy sports platform.,Undisclosed,Undisclosed,5000000.0,Series_A,2018-01-01,365 days,2018-01-01,2018
PlanetSpark,2017-01-01,Gurugram,Education,PlanetSpark is an after-school Maths and English learning program for pre teen kids between Grades 2nd to 7th.,Undisclosed,Undisclosed,192030.72491598656,Seed,2018-01-01,365 days,2018-01-01,2018
WheelsEMI,2017-01-01,Pune,Transportation & Logistics,"WheelsEMI is the brand name of NBFC, WheelsEMI Pvt. Ltd.",Undisclosed,Undisclosed,14000000.0,Series_B,2018-01-01,365 days,2018-01-01,2018
